{"checkpoint_basis":{"action_inventory":{"actions":[{"action_id":"paid_000000000000000000000003","ambiguity_review_reasons":[],"attempt":1,"authorization_previously_recorded":true,"binding":{"commitment_micro_usd":50000,"maximum_output_tokens":4000,"model":"gpt-5.6-terra","prepared_state_revision":3,"price_book_version":"openai-public-2026-08-07.v1","profile_sha256":"1111111111111111111111111111111111111111111111111111111111111111","request_sha256":"3333333333333333333333333333333333333333333333333333333333333333","route":"pass-3:attempt-003","run_id":"run_provider_pending_capacity_001","service_level":"interactive","stage":"creative_retry"},"blocking_action_ids":[],"consumption_evidence_present":true,"eligibility_reason":"consumption_evidence_present","necessary":true,"pass_id":"pass-3","provider_evidence_present":true,"provider_identity_present":true,"provider_operation_id":"resp_provider_pending_3","providerless_denial_eligible":false,"relationship":"blocking","route":"pass-3:attempt-003","state":"WAITING"},{"action_id":"paid_000000000000000000000004","ambiguity_review_reasons":[],"attempt":1,"authorization_previously_recorded":true,"binding":{"commitment_micro_usd":50000,"maximum_output_tokens":4000,"model":"gpt-5.6-terra","prepared_state_revision":4,"price_book_version":"openai-public-2026-08-07.v1","profile_sha256":"1111111111111111111111111111111111111111111111111111111111111111","request_sha256":"4444444444444444444444444444444444444444444444444444444444444444","route":"pass-4:attempt-003","run_id":"run_provider_pending_capacity_001","service_level":"interactive","stage":"creative_retry"},"blocking_action_ids":[],"consumption_evidence_present":true,"eligibility_reason":"consumption_evidence_present","necessary":true,"pass_id":"pass-4","provider_evidence_present":true,"provider_identity_present":true,"provider_operation_id":"resp_provider_pending_4","providerless_denial_eligible":false,"relationship":"blocking","route":"pass-4:attempt-003","state":"WAITING"},{"action_id":"paid_000000000000000000000005","ambiguity_review_reasons":[],"attempt":1,"authorization_previously_recorded":true,"binding":{"commitment_micro_usd":50000,"maximum_output_tokens":4000,"model":"gpt-5.6-terra","prepared_state_revision":5,"price_book_version":"openai-public-2026-08-07.v1","profile_sha256":"1111111111111111111111111111111111111111111111111111111111111111","request_sha256":"5555555555555555555555555555555555555555555555555555555555555555","route":"pass-5:attempt-003","run_id":"run_provider_pending_capacity_001","service_level":"interactive","stage":"creative_retry"},"blocking_action_ids":[],"consumption_evidence_present":true,"eligibility_reason":"consumption_evidence_present","necessary":true,"pass_id":"pass-5","provider_evidence_present":true,"provider_identity_present":true,"provider_operation_id":"resp_provider_pending_5","providerless_denial_eligible":false,"relationship":"blocking","route":"pass-5:attempt-003","state":"WAITING"},{"action_id":"paid_000000000000000000000001","ambiguity_review_reasons":[],"attempt":1,"authorization_previously_recorded":true,"binding":{"commitment_micro_usd":50000,"maximum_output_tokens":4000,"model":"gpt-5.6-terra","prepared_state_revision":1,"price_book_version":"openai-public-2026-08-07.v1","profile_sha256":"1111111111111111111111111111111111111111111111111111111111111111","request_sha256":"1111111111111111111111111111111111111111111111111111111111111111","route":"pass-6:attempt-003","run_id":"run_provider_pending_capacity_001","service_level":"interactive","stage":"creative_retry"},"blocking_action_ids":[],"consumption_evidence_present":true,"eligibility_reason":"consumption_evidence_present","necessary":true,"pass_id":"pass-6","provider_evidence_present":true,"provider_identity_present":true,"provider_operation_id":"resp_provider_pending_1","providerless_denial_eligible":false,"relationship":"blocking","route":"pass-6:attempt-003","state":"WAITING"},{"action_id":"paid_000000000000000000000002","ambiguity_review_reasons":[],"attempt":1,"authorization_previously_recorded":true,"binding":{"commitment_micro_usd":50000,"maximum_output_tokens":4000,"model":"gpt-5.6-terra","prepared_state_revision":2,"price_book_version":"openai-public-2026-08-07.v1","profile_sha256":"1111111111111111111111111111111111111111111111111111111111111111","request_sha256":"2222222222222222222222222222222222222222222222222222222222222222","route":"pass-6:attempt-003","run_id":"run_provider_pending_capacity_001","service_level":"interactive","stage":"creative_retry"},"blocking_action_ids":[],"consumption_evidence_present":true,"eligibility_reason":"consumption_evidence_present","necessary":true,"pass_id":"pass-6","provider_evidence_present":true,"provider_identity_present":true,"provider_operation_id":"resp_provider_pending_2","providerless_denial_eligible":false,"relationship":"blocking","route":"pass-6:attempt-003","state":"WAITING"},{"action_id":"paid_000000000000000000000006","ambiguity_review_reasons":[],"attempt":1,"authorization_previously_recorded":true,"binding":{"commitment_micro_usd":50000,"maximum_output_tokens":4000,"model":"gpt-5.6-terra","prepared_state_revision":6,"price_book_version":"openai-public-2026-08-07.v1","profile_sha256":"1111111111111111111111111111111111111111111111111111111111111111","request_sha256":"6666666666666666666666666666666666666666666666666666666666666666","route":"pass-6:attempt-003","run_id":"run_provider_pending_capacity_001","service_level":"interactive","stage":"creative_retry"},"blocking_action_ids":[],"consumption_evidence_present":true,"eligibility_reason":"consumption_evidence_present","necessary":true,"pass_id":"pass-6","provider_evidence_present":true,"provider_identity_present":true,"provider_operation_id":"resp_provider_pending_6","providerless_denial_eligible":false,"relationship":"blocking","route":"pass-6:attempt-003","state":"WAITING"}],"ordering_semantics":"deterministic_presentation_only_not_execution_order","run_id":"run_provider_pending_capacity_001","schema_version":"astrowoof.provider_action_inventory.v0.1"},"checkpoint_safe_for_worker_release":true,"consumer_authority":{"action_count":6,"action_ids":["paid_000000000000000000000001","paid_000000000000000000000002","paid_000000000000000000000003","paid_000000000000000000000004","paid_000000000000000000000005","paid_000000000000000000000006"],"actions":[{"action_id":"paid_000000000000000000000001","cost_disposition":"not_applicable_provider_pending","retention_reason":"provider_operation_pending"},{"action_id":"paid_000000000000000000000002","cost_disposition":"not_applicable_provider_pending","retention_reason":"provider_operation_pending"},{"action_id":"paid_000000000000000000000003","cost_disposition":"not_applicable_provider_pending","retention_reason":"provider_operation_pending"},{"action_id":"paid_000000000000000000000004","cost_disposition":"not_applicable_provider_pending","retention_reason":"provider_operation_pending"},{"action_id":"paid_000000000000000000000005","cost_disposition":"not_applicable_provider_pending","retention_reason":"provider_operation_pending"},{"action_id":"paid_000000000000000000000006","cost_disposition":"not_applicable_provider_pending","retention_reason":"provider_operation_pending"}],"state":"retain"},"external_authority_state":{"evidence_categories":[],"kind":"none","ordered_action_ids":[],"refusal_reason":null,"request_kind":null},"local_dependencies":[],"local_work_inventory":{"consumed_operation_keys":[],"inventory_sha256":"41131ba188a8c41195706b8c20265a118e2c3d6373c2d73e1d63ce4537ff84d3","logical_workspace_root":"C:\\Users\\kevin\\AppData\\Local\\Temp\\tmpfa6p7wg0","operations":[],"ordering_semantics":"sbe_selected_execution_order","run_id":"run_provider_pending_capacity_001","schema_version":"astrowoof.local_work_inventory.v1","snapshot_sha256":"f5cedffac1183dc175e8a9f7cccbc00a1157effa289a109a920eb1ba865b9941","state_revision":13},"native_route":{"route_contract":"astrowoof.semantic_closure_run.v0.9","route_family":"exact_natal"},"observation":{"inventory_valid":true,"logical_workspace_root":"C:\\Users\\kevin\\AppData\\Local\\Temp\\tmpfa6p7wg0","native_exclusive_access":"declared","operator_state_revision":13,"snapshot_complete":true,"snapshot_sha256":"f5cedffac1183dc175e8a9f7cccbc00a1157effa289a109a920eb1ba865b9941","writer_race_possible":false},"provider_custody":{"action_ids":["paid_000000000000000000000001","paid_000000000000000000000002","paid_000000000000000000000003","paid_000000000000000000000004","paid_000000000000000000000005","paid_000000000000000000000006"],"actions":[{"action_id":"paid_000000000000000000000001","custody_classification":"retain_consumer_authority","native_operation_ref":"pass-6:attempt-003","provider_operation_id":"resp_provider_pending_1","provider_operation_kind":"response","reason_code":"known_provider_operation_pending","resume_not_before":"2026-08-15T20:15:00Z","route_family":"exact_natal","service_level":"interactive","stage":"creative_retry"},{"action_id":"paid_000000000000000000000002","custody_classification":"retain_consumer_authority","native_operation_ref":"pass-6:attempt-003","provider_operation_id":"resp_provider_pending_2","provider_operation_kind":"response","reason_code":"known_provider_operation_pending","resume_not_before":"2026-08-15T20:16:00Z","route_family":"exact_natal","service_level":"interactive","stage":"creative_retry"},{"action_id":"paid_000000000000000000000003","custody_classification":"retain_consumer_authority","native_operation_ref":"pass-3:attempt-003","provider_operation_id":"resp_provider_pending_3","provider_operation_kind":"response","reason_code":"known_provider_operation_pending","resume_not_before":"2026-08-15T20:17:00Z","route_family":"exact_natal","service_level":"interactive","stage":"creative_retry"},{"action_id":"paid_000000000000000000000004","custody_classification":"retain_consumer_authority","native_operation_ref":"pass-4:attempt-003","provider_operation_id":"resp_provider_pending_4","p